{
  "schema": "reading-zoo.animals.seed.v1",
  "version": "1.1.0",
  "language": "cs-CZ",
  "count": 82,
  "licenseNote": "Animal images are Microsoft Fluent Emoji (3D), MIT licensed — see assets/animals-3d/LICENSE.md.",
  "animals": [
    {
      "id": "pes",
      "name": "Pes",
      "category": "savec",
      "biome": "domov",
      "readingLevel": 1,
      "wordDifficulty": 1,
      "sentence": "Pes štěká.",
      "fact": "Pes je nejlepší přítel člověka.",
      "tags": [
        "domaci",
        "srst",
        "steka"
      ],
      "imagePath": "assets/animals-3d/pes.png"
    },
    {
      "id": "kocka",
      "name": "Kočka",
      "category": "savec",
      "biome": "domov",
      "readingLevel": 2,
      "wordDifficulty": 3,
      "sentence": "Kočka mňouká.",
      "fact": "Kočka má ostré drápy a vousky.",
      "tags": [
        "domaci",
        "vousky",
        "domy"
      ],
      "imagePath": "assets/animals-3d/kocka.png"
    },
    {
      "id": "lev",
      "name": "Lev",
      "category": "savec",
      "biome": "savana",
      "readingLevel": 1,
      "wordDifficulty": 1,
      "sentence": "Lev řve.",
      "fact": "Lev je největší africká kočkovitá šelma.",
      "tags": [
        "kral",
        "hriva",
        "afrika"
      ],
      "imagePath": "assets/animals-3d/lev.png"
    },
    {
      "id": "sova",
      "name": "Sova",
      "category": "ptak",
      "biome": "les",
      "readingLevel": 1,
      "wordDifficulty": 2,
      "sentence": "Sova houkne.",
      "fact": "Sova má velké oči.",
      "tags": [
        "nocni",
        "velke-oci",
        "les"
      ],
      "imagePath": "assets/animals-3d/sova.png"
    },
    {
      "id": "liska",
      "name": "Liška",
      "category": "savec",
      "biome": "les",
      "readingLevel": 2,
      "wordDifficulty": 3,
      "sentence": "Liška běží.",
      "fact": "Liška má hustou rezavou srst.",
      "tags": [
        "ruda",
        "ocas",
        "les"
      ],
      "imagePath": "assets/animals-3d/liska.png"
    },
    {
      "id": "zebra",
      "name": "Zebra",
      "category": "savec",
      "biome": "savana",
      "readingLevel": 2,
      "wordDifficulty": 3,
      "sentence": "Zebra má pruhy.",
      "fact": "Každá zebra má jedinečný vzor pruhů.",
      "tags": [
        "pruhy",
        "afrika",
        "savana"
      ],
      "imagePath": "assets/animals-3d/zebra.png"
    },
    {
      "id": "kos",
      "name": "Kos",
      "category": "ptak",
      "biome": "les",
      "readingLevel": 1,
      "wordDifficulty": 1,
      "sentence": "Kos zpívá.",
      "fact": "Kos má žlutý zobák a hezky zpívá.",
      "tags": [
        "cerny",
        "zobak",
        "zpev"
      ],
      "imagePath": "assets/animals-3d/kos.png"
    },
    {
      "id": "krava",
      "name": "Kráva",
      "category": "savec",
      "biome": "statek",
      "readingLevel": 2,
      "wordDifficulty": 3,
      "sentence": "Kráva bučí.",
      "fact": "Kráva nám dává mléko a smetanu.",
      "tags": [
        "mleko",
        "statek",
        "rohy"
      ],
      "imagePath": "assets/animals-3d/krava.png"
    },
    {
      "id": "kun",
      "name": "Kůň",
      "category": "savec",
      "biome": "statek",
      "readingLevel": 1,
      "wordDifficulty": 2,
      "sentence": "Kůň klusá.",
      "fact": "Kůň je velmi rychlý a silný.",
      "tags": [
        "hriva",
        "rychly",
        "statek"
      ],
      "imagePath": "assets/animals-3d/kun.png"
    },
    {
      "id": "zaba",
      "name": "Žába",
      "category": "obojzivelnik",
      "biome": "rybnik",
      "readingLevel": 1,
      "wordDifficulty": 2,
      "sentence": "Žába skáče.",
      "fact": "Žába umí skákat i plavat.",
      "tags": [
        "zelena",
        "skace",
        "rybnik"
      ],
      "imagePath": "assets/animals-3d/zaba.png"
    },
    {
      "id": "slon",
      "name": "Slon",
      "category": "savec",
      "biome": "savana",
      "readingLevel": 1,
      "wordDifficulty": 2,
      "sentence": "Slon troubí.",
      "fact": "Slon má nejdelší nos ze všech zvířat.",
      "tags": [
        "chobot",
        "velky",
        "afrika"
      ],
      "imagePath": "assets/animals-3d/slon.png"
    },
    {
      "id": "medved",
      "name": "Medvěd",
      "category": "savec",
      "biome": "les",
      "readingLevel": 2,
      "wordDifficulty": 4,
      "sentence": "Medvěd spí.",
      "fact": "Medvěd odpočívá v brlohu.",
      "tags": [
        "velky",
        "hnedy",
        "les"
      ],
      "imagePath": "assets/animals-3d/medved.png"
    },
    {
      "id": "had",
      "name": "Had",
      "category": "plaz",
      "biome": "les",
      "readingLevel": 1,
      "wordDifficulty": 1,
      "sentence": "Had se plazí.",
      "fact": "Had nemá nohy a pohybuje se vlněním.",
      "tags": [
        "plaz",
        "jazyk",
        "bez-noh"
      ],
      "imagePath": "assets/animals-3d/had.png"
    },
    {
      "id": "beran",
      "name": "Beran",
      "category": "savec",
      "biome": "statek",
      "readingLevel": 1,
      "wordDifficulty": 2,
      "sentence": "Beran trká.",
      "fact": "Beran má velké zatočené rohy.",
      "tags": [
        "statek",
        "rohy",
        "vlna"
      ],
      "imagePath": "assets/animals-3d/beran.png"
    },
    {
      "id": "orel",
      "name": "Orel",
      "category": "ptak",
      "biome": "hory",
      "readingLevel": 1,
      "wordDifficulty": 2,
      "sentence": "Orel letí.",
      "fact": "Orel vidí svou kořist z velké výšky.",
      "tags": [
        "kridla",
        "hory",
        "zobak"
      ],
      "imagePath": "assets/animals-3d/orel.png"
    },
    {
      "id": "vlk",
      "name": "Vlk",
      "category": "savec",
      "biome": "les",
      "readingLevel": 1,
      "wordDifficulty": 1,
      "sentence": "Vlk vyje.",
      "fact": "Vlk žije v tlupě zvané smečka.",
      "tags": [
        "smedka",
        "les",
        "sedy"
      ],
      "imagePath": "assets/animals-3d/vlk.png"
    },
    {
      "id": "hroch",
      "name": "Hroch",
      "category": "savec",
      "biome": "reka",
      "readingLevel": 1,
      "wordDifficulty": 2,
      "sentence": "Hroch se koupe.",
      "fact": "Hroch tráví skoro celý den ve vodě.",
      "tags": [
        "voda",
        "velky",
        "reka"
      ],
      "imagePath": "assets/animals-3d/hroch.png"
    },
    {
      "id": "jelen",
      "name": "Jelen",
      "category": "savec",
      "biome": "les",
      "readingLevel": 2,
      "wordDifficulty": 3,
      "sentence": "Jelen běží.",
      "fact": "Jelen nosí velkolepé parohy.",
      "tags": [
        "parohy",
        "les",
        "hnedy"
      ],
      "imagePath": "assets/animals-3d/jelen.png"
    },
    {
      "id": "papousek",
      "name": "Papoušek",
      "category": "ptak",
      "biome": "les",
      "readingLevel": 3,
      "wordDifficulty": 3,
      "sentence": "Papoušek mluví.",
      "fact": "Papoušek umí opakovat slova.",
      "tags": [
        "barevny",
        "mluvi",
        "peri"
      ],
      "imagePath": "assets/animals-3d/papousek.png"
    },
    {
      "id": "prase",
      "name": "Prase",
      "category": "savec",
      "biome": "statek",
      "readingLevel": 2,
      "wordDifficulty": 3,
      "sentence": "Prase chrochtá.",
      "fact": "Prase se rád válí v bahně.",
      "tags": [
        "ruzove",
        "statek",
        "rypak"
      ],
      "imagePath": "assets/animals-3d/prase.png"
    },
    {
      "id": "ovce",
      "name": "Ovce",
      "category": "savec",
      "biome": "louka",
      "readingLevel": 2,
      "wordDifficulty": 3,
      "sentence": "Ovce bečí.",
      "fact": "Z vlny ovce se vyrábí teplé oblečení.",
      "tags": [
        "vlna",
        "bila",
        "louka"
      ],
      "imagePath": "assets/animals-3d/ovce.png"
    },
    {
      "id": "koza",
      "name": "Koza",
      "category": "savec",
      "biome": "statek",
      "readingLevel": 2,
      "wordDifficulty": 2,
      "sentence": "Koza mečí.",
      "fact": "Koza dává mléko a umí lézt do kopce.",
      "tags": [
        "rohy",
        "mleko",
        "statek"
      ],
      "imagePath": "assets/animals-3d/koza.png"
    },
    {
      "id": "kohout",
      "name": "Kohout",
      "category": "ptak",
      "biome": "statek",
      "readingLevel": 2,
      "wordDifficulty": 4,
      "sentence": "Kohout kokrhá.",
      "fact": "Kohout svým kokrháním oznamuje ráno.",
      "tags": [
        "hrebenek",
        "pero",
        "rano"
      ],
      "imagePath": "assets/animals-3d/kohout.png"
    },
    {
      "id": "slepice",
      "name": "Slepice",
      "category": "ptak",
      "biome": "statek",
      "readingLevel": 2,
      "wordDifficulty": 4,
      "sentence": "Slepice kdáká.",
      "fact": "Slepice snáší vajíčka.",
      "tags": [
        "vejce",
        "statek",
        "kur"
      ],
      "imagePath": "assets/animals-3d/slepice.png"
    },
    {
      "id": "kachna",
      "name": "Kachna",
      "category": "ptak",
      "biome": "rybnik",
      "readingLevel": 2,
      "wordDifficulty": 4,
      "sentence": "Kachna kváká.",
      "fact": "Kachna má nepromokavé peří.",
      "tags": [
        "zobak",
        "rybnik",
        "zelena-hlava"
      ],
      "imagePath": "assets/animals-3d/kachna.png"
    },
    {
      "id": "husa",
      "name": "Husa",
      "category": "ptak",
      "biome": "statek",
      "readingLevel": 2,
      "wordDifficulty": 2,
      "sentence": "Husa syčí.",
      "fact": "Husa je větší než kachna a hlasitě syčí.",
      "tags": [
        "bila",
        "krik",
        "dlahy"
      ],
      "imagePath": "assets/animals-3d/husa.png"
    },
    {
      "id": "kralik",
      "name": "Králík",
      "category": "savec",
      "biome": "louka",
      "readingLevel": 2,
      "wordDifficulty": 4,
      "sentence": "Králík skáče.",
      "fact": "Králík má dlouhé uši a rád žere mrkev.",